issue,title,primary finding,validator comment,status,root cause (URL),size
validation-103,isKnownLenderOnMarket is not set to false whenever a user withdraws all his scaled balance., ,"The protocol is designed to keep a lender's ""known"" status persistent, even if their balance becomes zero. this avoids unnecessary re-verification when the lender returns to the market, improving user experience and reducing gas costs.",Unsatisfactory,,140
validation-104,A user with expired credentials can receive tokens and bypass restrictions because credentials check is not enforced in the transfer hook as it is done in the deposit hook ,validation-326, ,Satisfactory,https://github.com/code-423n4/2024-08-wildcat/blob/main/src/access/FixedTermLoanHooks.sol#L893-L923,121
validation-105,Unauthorized Approval of Token Allowances,,spam,Unsatisfactory,,35
validation-107,Withdrawal Queue Can Remain Unfulfilled After Liquidity is Burnt,,spam,Unsatisfactory,,71
validation-108,`_executeWithdrawal` function does'nt verify whether the `accountAddress` has already withdrawn the full amount owed, ,spam,Unsatisfactory,,34
validation-115,FixedTermLoanHooks has DoS With Block Gas Limit in grantRoles Function,,spam,Unsatisfactory,,130
validation-116,FixedTermLoanHooks has Block Values as a Proxy for Time,,spam,Unsatisfactory,,91
validation-120,MarketConstraintHooks has Block Values as a Proxy for Time,,spam,Unsatisfactory,,85
validation-122,MarketStateLib library has Block values as a proxy for time,,spam,Unsatisfactory,,96
validation-133,Repaying outstanding debt by the borrower will not clear the debt in the system thus the contract still incurs more debt after calling this function,validation-123, ,Satisfactory,https://github.com/code-423n4/2024-08-wildcat/blob/main/src/market/WildcatMarket.sol#L226,120
validation-135,The contract goes back to being in a Delinquent state 1 seconds after repaying all DelinquentDebt because of a wrong repayment flow,validation-135,"primary - on the contrary if validation-123, this issue refers to another point",Satisfactory,https://github.com/code-423n4/2024-08-wildcat/blob/fe746cc0fbedc4447a981a50e6ba4c95f98b9fe1/src/market/WildcatMarket.sol#L186-L191,173
validation-144,LenderStatus has Unencrypted Private Data On-Chain,,spam,Unsatisfactory,,58
validation-145,LenderStatus has Block Values as a Proxy for Time,,spam,Unsatisfactory,,68
validation-150,LibTransientBytesArray has DoS with Block Gas Limit OOG,,spam,Unsatisfactory,,210
validation-151,The user may lose their funds when calling the WildcatMarketWithdrawals.executeWithdrawal() and WildcatMarketWithdrawals.executeWithdrawals() functions, , the submission does not provide step by step demonstration of the issue and the reasoning. ,Unsatisfactory,,24
validation-152,Possible DOS when calling HooksFactory.deployHooksInstance(),,insufficient proof - spammish,Unsatisfactory,,26
validation-153,Unable to call HooksFactory.deployMarket() on assets with Non string metadata Name/Symbol, ,OOS -> https://github.com/code-423n4/2024-08-wildcat/blob/main/4naly3er-report.md#L-7,Unsatisfactory,,26
validation-161,Bypassing Access Controls via Insufficient Validation of hooksData,,spam,Unsatisfactory,,85
validation-172,no access control on pushProtocolFeeBipsUpdates,,no content,Unsatisfactory,,25
validation-173,"In pushProtocolFeeBipsUpdates, there's a potential for an unbounded loop if the number of markets is very large, which could lead to out-of-gas errors.", ,spam,Unsatisfactory,,59
validation-174,deployMarket and deployMarketAndHooks functions could potentially be front-run,,spam,Unsatisfactory,,121
validation-18,HooksConfig contract has mcopy function Not Found,,insufficient proof - spammish,Unsatisfactory,,105
validation-183,Misaligned Function Selector in Inline Assembly ,,spam,Unsatisfactory,,102
validation-189,Potential for DOS,,spam,Unsatisfactory,,33
validation-190,Potential for Front-Running,,spam,Unsatisfactory,,28
validation-205,Misaligned Function Selector Allows Sanction Check Bypass,,spam,Unsatisfactory,,51
validation-206,create() is vulnerable to reorg attacks,,spam,Unsatisfactory,,64
validation-209,check for zero address in market,,spam,Unsatisfactory,,25
validation-21,WildcatArchController contract has Dependence on Predictable Environment Variable in Inherited completeOwnershipHandover Function, ,insufficient proof - spammish,Unsatisfactory,,230
validation-214,ReentrancyGuard has Storage Collision - Write to Arbitrary Storage Location,,spam - crafted POC,Unsatisfactory,,241
validation-219,Potential memory corruption,,spam,Unsatisfactory,,36
validation-22,WildcatSanctionsEscrow contract has External Call to User-Supplied Address in releaseEscrow function, ,spam,Unsatisfactory,,246
validation-232,should check the creation if the address code size is non-zero,,spam,Unsatisfactory,,89
validation-233,Inconsistent Minimum Balance Checks Enable Known Lender Status Bypass via `onTransfer` function,validation-233,primary,Satisfactory,https://github.com/code-423n4/2024-08-wildcat/blob/fe746cc0fbedc4447a981a50e6ba4c95f98b9fe1/src/access/AccessControlHooks.sol#L786-L791,76
validation-237,LibStoredInitCode has Denial of Service (DoS) with Block Gas Limit,,spam,Unsatisfactory,,152
validation-256, Malformed External Calls,,spam,Unsatisfactory,,38
validation-257,No check for from and msg.sender are different in transferfrom,,spam,Unsatisfactory,,54
validation-261,Incorrect Error Handling in Assembly,,spam,Unsatisfactory,,34
validation-262,Inability of `ArchController`  to enable disabled hookstemplate,validation-176,,Satisfactory,https://github.com/code-423n4/2024-08-wildcat/blob/fe746cc0fbedc4447a981a50e6ba4c95f98b9fe1/src/HooksFactory.sol#L205,56
validation-268,"Borrower can REVOKE A USER'S CREDENTIAL by Blocking the user instead of just preventing deposits, while the unblocking function if called will not return back the User's Revoked Role.",validation-238, ,Satisfactory,https://github.com/code-423n4/2024-08-wildcat/blob/fe746cc0fbedc4447a981a50e6ba4c95f98b9fe1/src/access/AccessControlHooks.sol#L447-L449,169
validation-274,Reentrancy Guard Prevent Internal Calls Between Protected Functions,,no real issue provided,Unsatisfactory,,63
validation-312,wrong implementation of registerBorrower.,,spam,Unsatisfactory,,29
validation-32,AccessControlHooks contract has Unchecked Function Call in status.setCredential in _setCredentialAndEmitAccessGranted function, ,spam,Unsatisfactory,,154
validation-321,Unbounded loops in pushProtocolFeeBipsUpdates(),,the bounds are indexes,Unsatisfactory,,45
validation-323,"safetransfer does not check the codesize of the token address, which may lead to fund loss",,insufficient proof,Unsatisfactory,,58
validation-324,Reentrancy Vulnerability in createEscrow(),,insufficient proof,Unsatisfactory,,44
validation-40,Blacklisted Assets Can Be Used as Origination Fee Assets in Hooks Templates,validation-40,primary,Satisfactory,https://github.com/code-423n4/2024-08-wildcat/blob/fe746cc0fbedc4447a981a50e6ba4c95f98b9fe1/src/HooksFactory.sol#L120,149
validation-55,Unsafe casting in '_calculateTemporaryReserveRatioBips()' function from 'uint256' to 'uint16' leads to loss of precision and data, ,insufficient proof,Unsatisfactory,,71
validation-56,Unprotected Initializer allows arbitrary contract deployment and could be exploited,,all library functions,Unsatisfactory,,104
validation-59,borrowers can bypass any sanctioned lender address by creating a lender account with different address., ,the submission is vague - concludes like borrower financing the borrower - needs more clearance,Unsatisfactory,,159
validation-60,originationFeeAsset can be a sanctioned asset,validation-40, ,Satisfactory,https://github.com/code-423n4/2024-08-wildcat/blob/fe746cc0fbedc4447a981a50e6ba4c95f98b9fe1/src/HooksFactory.sol#L120,94
validation-66,Address Collision and Stale Initialization Code Vulnerability in Market Deployment Using `LibStoredInitCode`, ,insufficient proof - spammish,Unsatisfactory,,56
validation-71,Premature Removal of Registered Controller After Recent Registration,,insufficient proof - spammish,Unsatisfactory,,47
validation-72,The `createEscrow` function in the `WildcatSanctionsSentinel` contract allows any user to deploy an escrow contract for any borrower, ,insufficient proof - spammish,Unsatisfactory,,83
validation-73,Optionality of `onQueueWithdrawal` Hook in `_onCreateMarket` Function,,insufficient proof - spammish,Unsatisfactory,,41
validation-76,HooksFactory has Insufficient Gas Griefing in pushProtocolFeeBipsUpdates function,,spam,Unsatisfactory,,149
validation-77,HooksFactory has DoS with Failed Call in pushProtocolFeeBipsUpdates function,,spam,Unsatisfactory,,199
validation-78,WildcatArchController contract has Insufficient Gas Griefing in updateSphereXEngineOnRegisteredContracts function, ,the calls are bounded,Unsatisfactory,,297
validation-82,WildcatSanctionsSentinel has DoS with Block Gas Limit Creating Too Many Escrows,,spam,Unsatisfactory,,130
validation-83,WildcatSanctionsSentinel has Transaction Order Dependence Sanction Overrides in overrideSanction function, ,spam,Unsatisfactory,,112
validation-84,WildcatSanctionsSentinel has DoS with Failed Call Escrow Creation Failure in createEscrow function, ,spam,Unsatisfactory,,144
validation-85,AccessControlHooks has DoS With Block Gas Limit Potential issue when looping through a large number of pull providers in getLenderStatus function, ,spam,Unsatisfactory,,155
validation-88,AccessControlHooks has Unchecked Call Return Value in _tryGetCredential the staticcall return value is not checked properly, ,spam,Unsatisfactory,,144
validation-95, Missing Bytecode Verification in Contract Deployment,,insufficient proof,Unsatisfactory,,54